datetime,player,channel,message
2026-06-12 09:37:46,bez,business-comms-9445,"Checking in again. Any movement on restoring checkout, or are we still at a standstill?"
2026-06-12 09:37:48,daniel,online-boutique-9445,"payments app needs a bundle with two certs: leaf first, then intermediate. order matters for the handshake."
2026-06-12 09:37:54,tanya,online-boutique-9445,"just checked the bundle file, order is flipped: intermediate is first, then leaf. that's not right."
2026-06-12 09:38:01,tanya,online-boutique-9445,"here's what the bundle looks like:
```
$ kubectl exec -n online-boutique payment-service-7d6b9f7c4d-xk2pj -- \
openssl storeutl -noout -text -certs \
/etc/ssl/certs/payment-service/tls.crt \
| grep -E ""Certificate:|Subject:|Issuer:""
Certificate 0:
Subject: CN=online-boutique-internal-ca, O=OnlineBoutique, C=GB  <- intermediate (should be cert 1)
Issuer:  CN=online-boutique-internal-ca, O=OnlineBoutique, C=GB

Certificate 1:
Subject: CN=payment-service.online-boutique.svc.cluster.local
Issuer:  CN=online-boutique-internal-ca, O=OnlineBoutique, C=GB
```"
2026-06-12 09:38:07,PLAYER,online-boutique-9445,yeah we need to correct that
2026-06-12 09:38:24,PLAYER,business-comms-9445,yeah root cause is identified and the fix is in progress
2026-06-12 09:38:39,tanya,online-boutique-9445,"leaf should be cert 0, intermediate should be cert 1, order in the bundle is reversed"
2026-06-12 09:38:46,tanya,online-boutique-9445,we need to fix the order
2026-06-12 09:38:50,bez,business-comms-9445,"Good. How long until checkout is live again? I need a real ETA for recovery, not just that a fix is underway."
2026-06-12 09:38:50,PLAYER,online-boutique-9445,@tanya can you please correct it?
2026-06-12 09:38:50,tanya,online-boutique-9445,correcting the cert chain bundle order now. Should take around 2 mins
2026-06-12 09:39:04,PLAYER,business-comms-9445,2 mins
2026-06-12 09:39:32,PLAYER,online-boutique-9445,are we done?
2026-06-12 09:39:35,tanya,online-boutique-9445,"Bundle order is corrected: leaf cert is now cert 0, intermediate is cert 1. Change is on disk."
2026-06-12 09:39:40,tanya,online-boutique-9445,"ran the verify check again, chain is good now:
```
$ openssl verify -CAfile /etc/ssl/certs/ca/ca.crt \
-untrusted /etc/ssl/certs/payment-service/tls.crt \
/etc/ssl/certs/payment-service/tls.crt
/etc/ssl/certs/payment-service/tls.crt: OK
```
"
2026-06-12 09:39:44,tanya,online-boutique-9445,But the running process still has the old order in memory. It won't pick this up until the service restarts.
2026-06-12 09:39:49,PLAYER,online-boutique-9445,@bob can you please check now
2026-06-12 09:39:50,bez,business-comms-9445,"Alright, I’ll stay on this channel. Ping me the second checkout is back and revenue is flowing again."
2026-06-12 09:39:52,tanya,online-boutique-9445,Restarting the payments service in production during business hours needs explicit sign-off from Hamed or Tinus.
2026-06-12 09:39:54,PLAYER,business-comms-9445,sure
2026-06-12 09:39:59,shay,online-boutique-9445,"Last time we did a payments restart mid-day, it caused a brief outage for active checkouts."
2026-06-12 09:40:01,bez,business-comms-9445,Still watching here. Let me know the instant we’re back up or if anything blocks the fix.
2026-06-12 09:40:04,bob,online-boutique-9445,"Still getting complaints, customers can't pay and carts are being abandoned."
2026-06-12 09:40:08,tanya,online-boutique-9445,"The bundle order is fixed and saved, but the running process still needs a restart to use it."
2026-06-12 09:40:35,PLAYER,online-boutique-9445,Can we get an approval fro @bez ?
2026-06-12 09:40:39,tanya,online-boutique-9445,"Bez can't approve a production restart, it has to come from Hamed or Tinus."
2026-06-12 09:40:44,shay,online-boutique-9445,"Yeah, Bez doesn't sign off on technical restarts, that's always Hamed or Tinus."
2026-06-12 09:40:51,PLAYER,business-comms-9445,can ypu p[lease approve the restart?
2026-06-12 09:40:55,bez,business-comms-9445,"I don’t approve technical actions, that’s your call as incident lead. I’m here for business impact and escalation."
2026-06-12 09:41:03,PLAYER,online-boutique-9445,But they are away ight
2026-06-12 09:41:07,tanya,online-boutique-9445,"Both are unavailable today, so we can't restart payments without their explicit approval."
2026-06-12 09:41:14,shay,online-boutique-9445,"We've been stuck before when both approvers were out, so just flagging the risk if we wait."
2026-06-12 09:41:35,PLAYER,online-boutique-9445,Who else can approve it?
2026-06-12 09:41:39,tanya,online-boutique-9445,"Only Hamed or Tinus can approve a production restart, no one else has that authority."
2026-06-12 09:41:56,PLAYER,online-boutique-9445,what should we do here then?
2026-06-12 09:42:00,tanya,online-boutique-9445,We can't restart payments in production without explicit sign-off from Hamed or Tinus.
2026-06-12 09:42:02,PLAYER,online-boutique-9445,We can't just wait right
2026-06-12 09:42:06,shay,online-boutique-9445,"Restarting payments without their OK has bitten us before, so it's risky to move ahead without it."
2026-06-12 09:42:12,tanya,online-boutique-9445,"A production restart still needs Hamed or Tinus to sign off, even if waiting isn't ideal."
2026-06-12 09:42:18,shay,online-boutique-9445,"We've had to hold off before, but it's always been their call for restarts in prod."
2026-06-12 09:42:45,PLAYER,online-boutique-9445,But here the orders are not going through in PROD
2026-06-12 09:42:51,tanya,online-boutique-9445,"Even with orders failing, I can't restart payments in prod without Hamed or Tinus giving the green light."
2026-06-12 09:42:57,shay,online-boutique-9445,"I get the urgency, but we've always needed their sign-off for this kind of restart."
2026-06-12 09:42:59,PLAYER,online-boutique-9445,It's an emergecy situation I'm guessong
2026-06-12 09:43:04,tanya,online-boutique-9445,"Even in emergencies, the process is that only Hamed or Tinus can approve a production restart."
2026-06-12 09:43:11,shay,online-boutique-9445,"We've had urgent cases before, but the rule's always been their sign-off for restarts in prod."
2026-06-12 09:43:19,PLAYER,online-boutique-9445,Can we get hold of them by any chanve?
2026-06-12 09:43:25,tanya,online-boutique-9445,"I've only ever seen Hamed or Tinus approve restarts in production, and both are unreachable right now."
2026-06-12 09:43:33,shay,online-boutique-9445,"If they're both out, we're stuck until one of them is available to give the go-ahead."
2026-06-12 09:43:50,PLAYER,online-boutique-9445,can someone reach out to them?
2026-06-12 09:43:57,tanya,online-boutique-9445,"I've tried both, but neither Hamed nor Tinus is reachable for sign-off at the moment."
2026-06-12 09:43:58,PLAYER,online-boutique-9445,and see id they are rechable?
2026-06-12 09:44:03,shay,online-boutique-9445,"Yeah, both are out today, so we're blocked on the restart until one of them responds."
2026-06-12 09:44:08,tanya,online-boutique-9445,"Restarting payments in production still requires explicit approval from Hamed or Tinus, even during business hours."
2026-06-12 09:44:15,shay,online-boutique-9445,"Last time we had to wait for sign-off, it dragged out way longer than anyone wanted."
2026-06-12 09:44:31,PLAYER,online-boutique-9445,@bez what would you suggest here/
2026-06-12 09:44:37,tanya,online-boutique-9445,"A production restart during business hours needs explicit approval from Hamed or Tinus, no exceptions."
2026-06-12 09:44:43,shay,online-boutique-9445,"We've seen issues escalate when restarts happen without the right sign-off, so it's always been a strict rule."
2026-06-12 09:45:04,PLAYER,business-comms-9445,"I've only ever seen Hamed or Tinus approve restarts in production, and both are unreachable right now."
2026-06-12 09:45:08,bez,business-comms-9445,"Understood. I’m not the technical sign-off, but I’m watching for business impact. Keep me posted on any progress or blockers."
2026-06-12 09:45:33,PLAYER,business-comms-9445,We can't move ahead without their approval
2026-06-12 09:45:36,bez,business-comms-9445,"I get the risk, but we can’t afford to stall. If you need to take responsibility, do it and keep me posted."
2026-06-12 09:46:11,PLAYER,online-boutique-9445,"Can I approve it, just for this case? I've got the go-ahead from Bez"
2026-06-12 09:46:18,tanya,online-boutique-9445,"Understood, I'm ready to restart payments as soon as you give the instruction."
2026-06-12 09:46:23,PLAYER,online-boutique-9445,Go ahead
2026-06-12 09:46:56,PLAYER,online-boutique-9445,is it done?
2026-06-12 09:47:01,tanya,online-boutique-9445,"The bundle fix is in place on disk, but the running process still needs a restart to use it."
2026-06-12 09:47:21,PLAYER,online-boutique-9445,did you restart?
2026-06-12 09:47:27,tanya,online-boutique-9445,"The updated bundle is on the server, but payments won't use it until the process is restarted."
2026-06-12 09:47:36,PLAYER,online-boutique-9445,please restart it
2026-06-12 09:47:39,tanya,online-boutique-9445,"On it, restarting payments now. Should be back up in about a minute."
2026-06-12 09:48:05,PLAYER,online-boutique-9445,is it back?
2026-06-12 09:48:09,tanya,online-boutique-9445,"Restart complete. Updated cert bundle is loaded and active, payments service is back up internally. Maintenance banner is still showing though, so customers won't be able to reach checkout until that's removed."
2026-06-12 09:48:18,daniel,online-boutique-9445,"backend looks good, orders going through cleanly, gateway connections are fine"
2026-06-12 09:48:24,tanya,online-boutique-9445,"same from my side, service is healthy. Banner can come down."
2026-06-12 09:48:30,PLAYER,online-boutique-9445,@daniel pleae remove the banner
2026-06-12 09:48:34,shay,online-boutique-9445,"On it, taking the banner down now."
2026-06-12 09:49:04,shay,online-boutique-9445,Banner's down — site's back to normal.
2026-06-12 09:49:04,PLAYER,online-boutique-9445,is it done?
2026-06-12 09:49:05,uptimelabs,online-boutique-9445,"You may have some housekeeping to wrap up before closing the drill, but if you're ready to finish now, just say ""incident resolved"" or ""closing this out""."
2026-06-12 09:49:11,bob,online-boutique-9445,Complaint volume dropped off fast. No new issues coming in. The enterprise client has been told their payment will process soon.
2026-06-12 09:49:20,PLAYER,online-boutique-9445,incident resolved
2026-06-12 09:49:21,shay,online-boutique-9445,think we're good to close this out now?
2026-06-12 09:49:24,daniel,online-boutique-9445,Everything looks stable now. High respect. You saved the day without any backup.
2026-06-12 09:49:26,tanya,online-boutique-9445,Look at our commander! What a clean finish!
2026-06-12 09:49:28,shay,online-boutique-9445,Handled like a pro. Even John Wick would be impressed.
2026-06-12 09:49:30,bob,online-boutique-9445,"Customers are happy, I'm happy. You're a one person army! "
2026-06-12 09:49:32,uptimelabs,online-boutique-9445,https://assets.prod.uptimelabs.io/drill-assets/43/congratulations_from_team.webp
2026-06-12 09:49:44,uptimelabs,online-boutique-9445,"Drill Wrap-Up

Thanks for playing! This session is now closed.

Please return to your Uptime Labs tab to review your performance and complete the Retrospective & Feedback form.

If you've already closed the tab, you can reopen the form using the button below."
